{
  "schema_version": "catalog-pipeline-draft-0.1.0",
  "synthetic": true,
  "id": "urn:pya:synthetic:hardware:synthetic-hardware:1",
  "revision": 1,
  "entity_kind": "hardware",
  "display_name": "Fictional Comet accelerator",
  "lifecycle": "candidate",
  "claims": [
    {
      "id": "urn:pya:synthetic:hardware:synthetic-hardware:1:claim:1",
      "path": "spec.memory_gib",
      "value_type": "integer",
      "value": 8,
      "evidence": {
        "class": "Vendor claim",
        "confidence": "Unverified",
        "verification": "not_verified",
        "basis": "Fictional source wording for parser and policy tests only."
      },
      "sources": [
        {
          "source_id": "urn:pya:synthetic:source:fictional-lab",
          "material_id": "urn:pya:synthetic:material:metadata:1",
          "url": "https://example.invalid/synthetic/fictional-lab",
          "observed_at": "2026-10-01T12:00:00Z",
          "source_revision": "fictional-fixture-1"
        }
      ],
      "conditions": [
        "Synthetic fixture only; no empirical or deployment meaning."
      ],
      "unit": "GiB"
    },
    {
      "id": "urn:pya:synthetic:hardware:synthetic-hardware:1:claim:2",
      "path": "evidence.independent_result",
      "value_type": "unknown",
      "unknown_reason": "No independently reproduced result exists for this fictional example.",
      "evidence": {
        "class": "Estimate",
        "confidence": "Unverified",
        "verification": "not_verified",
        "basis": "Illustrates a known evidence gap; no numerical estimate is supplied."
      },
      "sources": [
        {
          "source_id": "urn:pya:synthetic:source:fictional-lab",
          "material_id": "urn:pya:synthetic:material:metadata:1",
          "url": "https://example.invalid/synthetic/fictional-lab",
          "observed_at": "2026-10-01T12:00:00Z",
          "source_revision": "fictional-fixture-1"
        }
      ],
      "conditions": [
        "Unknown must not become false, zero, unsupported, or measured."
      ]
    }
  ],
  "relationships": [],
  "unknowns": [
    "All identities and claims are fictional.",
    "No publication permission for a real source or product is asserted."
  ]
}
